,0
354,цикламен комнатный белый малиновый середина
355,коврик придверный резина кокос кот серый
356,защитный соль посудомоечный машина польша
357,измерительный алюминиевый угольник
358,рассада арбуз шуга бэби горшок
359,гладильный доска ника бэлльюниор
360,подвесной кашпо калибрахоа сиреневый махровый
361,штора ванный душа текстильный хсмлилия бежевыйбелый розовый цветок
362,роза одноголовый свита юник эквадор плантация штука упаковка
363,петуния желтый звезда
364,роза кордан красный
365,вешалка настенный ника вптб полка крючок белый
366,средство мытье посуда гранат россия
367,лестницастремянка примус оцинковывать металл ступень
368,шнур резиновый тележка белый
369,цикламен комнатный белый
370,двуспальный постельный белье арктик белый хлопок
371,подарочный набор март тюльпан розовый луковица подарочный упаковка открытка
372,барвинок синий
373,ерш унитазный пластмассовый ваир
374,тарелка десертный
375,мыльница пластмассовый ванна
376,контейнер продукт голубой
377,цитрофортунелла кумкват штамбовый
378,фуксия белый красный чашелист
379,термос стеклянный колба
380,тарелка обеденный океан эклипсы
381,антуриум андрианум пикассо голубой
382,рассада кабачок зебра кассета
383,однолетний растение алиссум кассета россия
384,столовый ложка боннтяжелый
385,сумкатележка хозяйственный оранжевый
386,наволочка арктик хлопок белый
387,роза палас белый
388,кодонант укоренять черенок
389,иссоп лекарственный
390,основание пробка электрический
391,ведро пластиковый универсальный цвет морской волна
392,тележка багажный тбр черный грузоподъемность сумка каркас россия
393,сушилка белье алюминий
394,тарелка десертный ирис
395,блюдце утро эклипсы франция
396,роза садовый парковый горшок чиппендейл
397,штора встроенный кольцо штанга ванна душа жаккард полиамидный покрытие бежевый
398,таз пластмассовый пищевой галс
399,томат помидор абруццо индетерминантный среднеспелый красный
400,муляж перец чили мини красный
401,совок щетка стальной длинный рукоятка
402,рассада зелень кухня лаванда прован
403,ковш пластмассовый
404,ложка обувной металлический красить крючок
405,подвесной кашпо пеларгония махровый розовый
406,подвесной кашпо калибрахоа красный махровый
407,гипсофил аврора израиль штука упаковка
408,петуния гибридный ампельный
409,скребок кондитерский лавандовый
410,таз пластмассовый круглый пластик
411,набор нож предмет
412,чехол гладильный доска хлопок
413,базилик застольный
414,клубника хоня крым
415,портулак рассада однолетний цветок кассета
416,сушилка белье настенный складной алюминиевый белый
417,бульонница мистигря
418,этажерка цветочный пластиковый ливия кашпо мпластика
419,подарочный набор март гиацинт розовый луковица подарочный упаковка открытка
420,соковарка нержавеющий сталь
421,стремянка ступень стальной
422,цветок искусственный ромашка цветок пластик
423,салатник колорама рэд
424,гладильный доска дсп бэлльюниор ника
425,шило пластмассовый ручка утолщенный крючок
426,половник пластик
427,пеларгония зональный простой цвет фуксия
428,веник подметание сорго шов
429,щетка хозяйственный стекло пластика синтетический каучук голубой
430,жестяной банка гусь
431,муляж персик оранжевый полиуретан
432,искусственный цветок калла большой пластиковый белозеленый
433,набор фужер красный вино серия касабланка
434,львиный зев рассада однолетний цветок кассета
435,муляж гранат красный красный
436,мята колосистый
437,пеларгония зональный махровый микс
438,штора ванная спирелла фиолетовый текстиль
439,искусственный цветок букет примула пластиковый красный
440,шеффлер голд капелла
441,тимьян крымский
442,петуния желтый прожилка
443,азалия индик розовый
444,гладильный доска ника гранд
445,ерш туалет подставка фарфор белый
446,ложка обувной металлический красить
447,цветок искусственный василек цветок пластик
448,петуния махровый рассада однолетний цветок кассета
449,маттиола ночной фиалка
450,толкушка деревянный бук
451,рассада зелень кухня шалфей горшок
452,комнатный растение горшок плющ хедер салатовый листва подвесной горшок
453,полка рио белыйчерный
454,коврик влаговпитывать ребристый стандарт зеленый
455,рассада капуста белокачать средний реванш кассета
456,чайный ложка предмет вена счв
457,подвесной кашпо калибрахоа смесь махровый окраска
458,корзина мягкий пластиковый мпластика
459,карниз ванный комната виолета раздвижной кольцо серый
460,петуния синий
461,тарелка десертный котон флауэр
462,защитный экран подставка дуршлаг цвет зеленый силикон
463,искусственный цветок букет примула пластиковый желтый
464,эвкалипт гунни
465,таз пластмассовый пищевой косметь ангора
466,крючок проволочный латунь
467,стакан низкий лабиринт напиток
468,штора ванный комната бежевый текстильный
469,терка нержавеющий сталь грань красный ручка
470,пеларгония душистый
471,столовый ложка цветной горох
472,капсикум сальса оранжевый
473,гладильный доска ника бест
474,сумкатележка колесный фуксия
475,кольцо штора виолета пластик
476,муляж томат оранжевый полиуретан
477,набор посуда нержавеющий сталь предмет россия
478,петуния красный сердце желтый фон
479,томат помидор кибица детерминантный среднеспелый красный
480,ложка кухонный
481,пододеяльник карменва хлопок
482,овсянница сизый серый
483,подвесной кашпо дихондр серебристый
484,тарелка обеденный лимон фица франция
485,чехол костюм
486,цветок искусственный гвоздик пластиковый одиночный ассортимент
487,чехол гладильный доска хлопок войлок доска
488,дендробиум санки полар файр ствол
489,патиссон нло оранжевый раннеспелый
490,огурец закусочный пчелоопыляемый кассета штука раннеспелый
491,коврик ванная прямоугольный голубой
492,подставка яйцо
493,средство быстрый удаление жировой загрязнение антижир россия
494,чайный набор лили флауэр
495,вешалка гардеробная радуга зми черный внп
496,комплект махровый полотенце промой хлопок
497,рассада дыня эфиопка горшок
498,набор фужер вино аллюр франция
499,виола рогатый сиреневый
500,рассада огурец родничок кассета
501,рукав гладильный доска
502,подголовник
503,томат помидор баскью блю детерминантный среднеспелый синий
504,щетка хозяйственный одежда пластиковый ручка белокрасный
505,разделочный доска
506,гимнокалициум микс
507,хлорофитум укоренять черенок
508,рассада огурец даша кассета
509,настурция драгоценность вишневорозовый
510,салатник карин гранит франция
511,пеларгония зональный краснорозовый простой
512,таз пластмассовый пищевой минеральный вода
513,утюг черный оранжевый керамический подошва самоочистка паровой удар
514,чехол гладильный доска полиэстер хлопок
515,декабрист горшок малиновый
516,набор вешалка мягкий тканевый перекладина валиант
517,коврик коричневый
518,сушилка белье потолочный лиана
519,завертка форточный белаяантик полимерный покрытие тонар
520,томат помидор шахерезад детерминантный среднеспелый красный
521,искусственный лист клен зеленый
522,герань домашний пеларгония зональный цвести розовокрасный полумахровый
523,чехол гладильный доска клубок пряжа серыйрозовый хлопок
524,пеларгония зональный ярко розовый полумахровый
525,простыня резинка односпальный арктик хлопок белый
526,розмарин
527,бегония клубневой оранжевый горшок
528,коврик придверный полиэстер перерабатывать резина серый
529,урнапепельница становиться хоббик
530,складной детский пуф пожарный машинка красный
531,чехол гладильный доска хлопок ассортимент
532,астра альпийский микс
533,универсальный нож нержавеющий становиться русский мотив деревянный ручка
534,штора ванный комната пвх прозрачный
535,косметь кэнди страйп
536,коврик придверный каучуковый черный
537,рассада огурец портос кассета
538,кастрюля чугунный красный
539,примула комнатный акаулис красный
540,лестницастремянка оцинковывать ступенчатый
541,томат помидор казацкий детерминантный среднеспелый красный
542,рассада зелень кухня базилик тонус кассета
543,чехол металлизированый поролон доска
544,калибрахоа малиновый
545,минисковорода сердце антипригарный покрытие
546,муляж груша мини желтый
547,томат помидор розовый мохнатый кабан индетерминантный среднеспелый розовый
548,чайник электрический василиса нержавеющий сталь
549,сковорода алюминиевый антипригарный покрытие диаметр крышка хозлэнд
550,ерш бутылочный металлический ручка малый
551,корзина белье белый
552,искусственный цветок мимоза пластиковый желтый
553,однолетний растение виола кассета россия
554,подушка цвет ассортимент
555,роза садовый плетистый горшок шванензей
556,сковорода алюминиевый антипригарный покрытие
557,салатник арти грин
558,цветущий комнатный растение бегония элатиор цвет ассортимент
559,пуансеттия горшок розовый
560,настурция лунный свет
561,крючок одежный двойной усиленный алюминиевый дюраль
562,чайный набор отантик сильвер
563,сушилка белье потолочный
564,седум очиток видный красный
565,нож тонкий нарезка нержавеющий сталь пилообразный синий
566,календула суприма
567,гардения укоренять черенок
568,набор нож нержавеющий сталь предмет деревянный подставка коричневый
569,петля приварной гаражный шар
570,роза садовый спрей горшок лидия вайт
571,роза садовый парковый горшок август луиза
572,коврик ванный комната полиэстер темнозеленый
573,коврик противоскользящий кружевной прозрачный
574,тележка хозяйственный
575,рассада патиссон нло оранжевый кассета
576,гладильный доска ника корица
577,кружка нордик прозрачный франция
578,косметь клюквенный клик
579,пеларгония зональный махровый лососевый
580,рассада зелень кухня лаванда кассета
581,муляж гранат красный
582,цветок искусственный роза открытимый бутон цвет ассортимент
583,покрытие гладильный доска арт
584,штора ванный комната бежевый
585,вешалка костюм прямой красный дерево
586,петуния ампельный розовый горшок
587,однолетний растение лобелия кассета россия
588,герань домашний пеларгония зональный цвести розовый махровый
589,томат помидор полосатый смайлик детерминантный раннеспелый красный
590,лавр
591,камнеломка арендс флорал карпет розовый
592,термос
593,скатерть династия полиэфир прямоугольный сливочный династия
594,корзина белье темнокоричневый
595,петуния виннобелый звезда
596,вешалка деревянный верхний одежда
597,кухонный ножницы нержавеющий становиться орехокол
598,пеларгония зональный ярко красный махровый
599,тележка хозяйственный колесный большой кралье тип
600,вешалка настенный ника внт крючок черный
601,коврик бежевый сушка посуда
602,набор столовый прибор предмет
603,шалфей овощной нектар кассета штука
604,ведро мусор любимец
605,полка ньюйорк правый белыйголубой
606,искусственный цветок букет калла пластиковый белозеленый
607,чистить крем трудновыводимый пятно индонезия
608,однолетний растение целозия метельчатый кассета россия
609,петуния рассада смесь цветок лист бургундить малиновый
610,рассада патиссон диск кассета
611,петуния рассада смесь цветок лист глория махровый розовый
612,чехол одежда стенка пвх ручка
613,набор прищепок большой пластиковый пиноккио
614,капуста кольраби венский белый кассета штука скороспелый
615,анемон белый
616,пеларгония зональный сиреневый полумахровый
617,щетка посуда оля мультипласт
618,муляж перец чили связка красный полиуретан
619,вешалка металлический четыре разъемный перекладина противоскользящий покрытие
620,таз пластмассовый стиральный доска
621,скатерть пвх овальный бежевый
622,полка берлин черный
623,цикламен
624,коврик ванный комната листопад зеленый
625,цикламен комнатный красный
626,вешалка мягкий деликатный вещь желтый
627,томат помидор оранжевый банан индетерминантный среднеспелый оранжевый
628,томат помидор кумато детерминантный среднеспелый черный
629,цикламен комнатный малиновый
630,пеларгония зональный розоцветный маргарита лососевый лист
631,гвоздик стандартный белый колумбия плантация штука упаковка
632,стремянка ступень черый
633,таз пластмассовый пищевой овальный ручка
634,смолевка звездный взрыв
635,подвесной кашпо калибрахой белый
636,сумкатележка хозяйственный желтый
637,чайный ложка цветной горох
638,контейнер мусор пластиковый ролл топ серый
639,рассада капуста белокачивать валентина кассета
640,рассада огурец магнат кассета
641,цветущий комнатный растение хризантема диаметр горшок
642,хризантема космо микс
643,муляж апельсин полиуретан
644,штора ванный комната коричневый
645,сальвия рассада однолетний цветок кассета
646,сушилка белье потолочный лиана люкс лднт
647,сетка стирка белье белый
648,чехол гладильный доска бязь доска
649,чайник заварочный элиз
650,швабра многофункциональный
651,однолетний растение львиный зев кассета россия
652,контейнер свч пцлм паровыпускной клапан лайм
653,термос стеклянный колба серозеленый
654,салфетка натура
655,коврик противоскользящий кружевной голубой
656,примула желтый оранжевый горшок
657,рассада томат помидор моравский чудо индетерминантный раннеспелый красный
658,искусственный цветок крокус пластиковый розовый
659,ковер придверный коричневый
660,пуансетия топпер день учитель подарочный упаковка
661,фуксия синий белый чашелист
662,ящик почтовый металлический ушко навесный замок домик
663,однолетний растение бегония вечноцветущий кассета россия
664,нож овощ мясо
665,роза садовый чайногибридный горшок супер грин
666,кружка марля эклипсы франция
667,мята
668,декоративный композиция искуственный цветок букет пион цветок цвет ассортимент
669,коврик придверный полиэстер перерабатывать резина серокоричневый
670,незабудка смесь
671,стакан пластмассовый конус пластхозторг
672,томат помидор абрикос индетерминантный среднеспелый красный
673,сумкатележка колесный складной серый
674,соковарка алюминиевый хозлэнд
675,вакуумный пакет хранение вещь
676,сушилка белье настенный
677,искусственный цветок роза закрытый малый пластиковый желтый
678,табак курительный юбилейный новый кассета штука среднеспелый
679,сумкатележка колесный синий
680,сушилка белье батарея ника двухъярусный
681,чайник эмалированный алый мак свисток
682,рассада зелень кухня мята икс пиперит цитрат шоколад
683,томат помидор моравский чудо индетерминантный раннеспелый красный
684,фуксия ампельный
685,розмарин горшок
686,рассада зелень кухня петрушка кучерявец кассета
687,тыква крупноплодный лечебный раннеспелый
688,стакан ванный комната керамика черный
689,покрывало жаккард стеганый наволочка
690,искусственный цветок ландыш пластиковый малый белый
691,цинния оранжевый король
692,петуния ампельный синий горшок
693,фиксаторшар хромой большой
694,тарелка суповой воларэ блэк
695,корзина белье эльфпласт виола бежевый
696,калла крупноцветковый желтый
697,корзина колесо темнокоричневый
698,пеларгония зональный ярко розовый махровый
699,гладильный доска ника тефлон
