,0
1366,примула комнатный красный
1367,рассада огурец герман кассета
1368,декоративный композиция искуственный цветок букет подсолнух бутон
1369,сушилка белье напольный ника сбг белоголубой
1370,роза чайногибридный восточный экспресс сливочножелтый цвет малиновый край горшок
1371,эхеверие лить чин
1372,хамедорей
1373,коврик придверный узор
1374,сушилка белье ника
1375,роза садовый чайногибридный горшок колетт
1376,вербена крупноцветковый белый
1377,рассада дыня алтайский горшок
1378,гладильный доска перф металл ника ника
1379,мята перечный тач мандариновый мята укоренять черенок
1380,петуния краснорозовый прожилка
1381,муррайя
1382,подвесной кашпо калибрахоа красный
1383,муляж хлеб белый кусок
1384,тарелка обеденный аморить браун
1385,веник подметание сорго шов кольцо
1386,однолетний растение астра кассета россия
1387,подвесной кашпо лобелия регатт микс
1388,томат помидор южный вечер детерминантный среднеспелый черный
1389,скатерть прямоугольнай бежевый
1390,герань домашний пеларгония зональный цвести белый полумахровый
1391,рассада томат помидор монгольский карлик детерминантный раннеспелый красный
1392,сумкатележка хозяйственный
1393,подрукавник гладильный доска
1394,щетка мытье окно телескопический ручка поворотный шарнир синий
1395,тряпкодержатель металлический крепление
1396,щетка посуда мила
1397,вешалка верхний одежда
1398,салатник романтик гарден
1399,вилка столовая тяжелый серия сапфир
1400,подвесной кашпо калибрахоа фиолетовый махровый
1401,плед флисовый атланта полиэстер
1402,рассада зелень кухня тимьян сильвер квин
1403,вилка столовая цветной горох
1404,антуриум тропик найт нидерланды штука упаковка
1405,салатник биантэ анис
1406,лобелия рассада однолетний цветок кассета
1407,сверло металл цилиндрический хвостик гост
1408,скатерть арлета полиэфир хлопок овальный светлобежевый арлета
1409,рассада капуста белокачать амтаман кассета
1410,зубной паста против образование зубной камень корея
1411,скатерть ажурный прямоуголный сепия
1412,салфетка камушек транспарент
1413,адиантум лиза
1414,хоста микс
1415,паста полировка гои
1416,папоротник страусник зеленый
1417,лаватер монт блан
1418,калибрахоа сиреневый махровый
1419,корзина белье фиолетовый
1420,тарелка обеденный стелла шоколад
1421,щетка мытье посуда колибри больший
1422,рассада капуста белокачать универс кассета
1423,рассада клубника зенг зенган кассета
1424,цветок искусственный мак пластик
1425,сумкатележка хозяйственный серый
1426,фиалка махровый голубой
1427,клен ложноплатановый леопольди горшок
1428,салат рукол сицилия
1429,огурец засолочный
1430,рассада огурец кристина ячейка
1431,калибрахоа красный
1432,герань домашний пеларгония зональный цвести лососевый полумахровый
1433,набор вешалка пластмассовый
1434,коврик придверный полиэстер изменчивость
1435,томат помидор канестрин индетерминантный среднеспелый красный
1436,вешалка гардеробная радуга зми белый серебро внп
1437,седум почвопокровный смесь окраска
1438,эхеверие перл фон нюрнберг
1439,лапчатка огненный пламень
1440,щеткасметка пластиковый ручка лаура
1441,хризантема красный тобаго
1442,тарелка десертный магда
1443,роза садовый чайногибридный горшок лимбо
1444,чайный набор сельма франция
1445,ведро ртслрозра сливочнорозовый
1446,рассада томат помидор зефир шоколад горшок
1447,бегония клубневой рассада однолетний цветок горшок
1448,этажерка обувь ника этпз ящик золотой
1449,томат помидор медовый капля индетерминантный среднеспелый желтый
1450,держатель туалетный бумага полимербыт
1451,томат помидор мэризол мэджик индетерминантный среднеспелый оранжевый
1452,эхинокактус грузонь
1453,однолетний растение петуния простой кассета россия
1454,однолетний растение тагетис мелкоцветковый кассета россия
1455,гладильный доска эко инж
1456,чехол гладильный доска универсальный ника
1457,банка крышка бугельный замок
1458,коврик противоскользящий овальный черепаха
1459,полка италия белыйсерый
1460,перчатка чистка овощ детский оранжевый
1461,сумка тележка малый комбинировать
1462,окномойка алюминиевый телескопический ручка щетка
1463,покрывало вельсофт вышивка
1464,муляж оранжевый яблоко мини полиуретан
1465,пахира акватик мультисть
1466,гладильный доска ника дсп эконом
1467,вешалка ника комфорт напольный серебро вкс
1468,штора ванный комната полиэстер фиолетовый
1469,рассада зелень кухня тимьянчабрец розовый
1470,чехол металлизированный полоса поролон доска
1471,полотенце кухонный милый хлопок цвет ассортимент
1472,ковер придверный черный
1473,пеларгония зональный малиновый красный полумахровый
1474,искусственный цветок тюльпан пластиковый закрытый лиловый
1475,коврик хлопковый цвет ассортимент
1476,фуксия ампельный нежнорозовый подвесной кашпо
1477,махровый полотенце севилья микрофибра
1478,бальзамин новогвинейский розовый
1479,набор фужер дампьер сильвер вино
1480,фиалка микс
1481,рассада дыня колхозница горшок
1482,муляж виноград желтый полиуретан
1483,рассада томат помидор шайметь криг детерминантный раннеспелый красный
1484,спатифиллум шопен
1485,ясколка войлочный белый
1486,дыня дина раннеспелый
1487,набор эмалированный салатник ветка рябина
1488,штора встроенный кольцо штанга ванна душа жаккард полиамидный покрытие аквамарин
1489,штора ванная спирелла белый текстиль гидрофобный пропитка
1490,скатерть сидней полиэфир овальный сиреневый сидней
1491,запасный насадка ерш пластик чернобелый
1492,сушилка мультя
1493,гвоздик турецкий роковой страсть
1494,искусственный цветок роза бархатный закрывать бутон цвет ассортимент
1495,рассада огурец изящный кассета
1496,бакоп ампельный махровый сиреневый махровый
1497,пеларгония плющелистный микс
1498,фиалка белый махровый
1499,тагетис крупноцветковый рассада однолетний цветок кассета
1500,искусственный цветок роза закрытый малый пластиковый белый
1501,пылесос красный мешок сбор пыль подарок мощность всасывание
1502,лапчатка травянистый желтый
1503,полк обувь коричневый
1504,календула бронзовый красавица
1505,скатерть донна роза пвх букет овальный
1506,роза садовый чайногибридный горшок блекнуть бакар
1507,рассада кабачок золотинка кассета
1508,крючок проволочный оцинковывать
1509,контейнер герметичный прямоугольный виолета дымчатый
1510,ерш унитазный деревянный ручка ваир
1511,щетка палубный рядный черенок угловой держатель
1512,насадка ведро пластиковый зеленый
1513,искусственный лиана плющ
1514,пылесос синий мешок сбор пыль подарок мощность всасывание
1515,рассада патиссон нло белый кассета
1516,скатерть виниловый тисненый ажурный кайма водонепроницаемый
1517,скатерть лион полиэстер
1518,коврик придверный полипропилен пес кот бежевый
1519,лавр горшок
1520,нолина цветной керамика
1521,табак бордовый кассета штука
1522,вероника колосковый микс
1523,скатерть донна роза пвх роза круглый
1524,сумкатележка стальной каркас синий
1525,муляж райский яблочко зеленый полиуретан
1526,вигна лилиана кассета штука среднеспелый
1527,эхеверие микс
1528,кружка бамбук франция
1529,вешалка настенный ника впс полка крючок серебро
1530,кореопсис толла
1531,герань домашний пеларгония зональный цвести темнорозовый полумахровый
1532,рассада огурец конни кассета
1533,коврик противоскользящий камешек ракушка овальный голубой
1534,петуния фиолетовый белый брызги
1535,увлажнять маска корея
1536,фиалка синий белый рифленый
1537,миксер василиса белый красныммалиновый скоростной режим
1538,рассада кабачок сосновский кассета
1539,рассада зелень кухня розмарин оффициналис мисс джесоп
1540,щетка универсальный телескопический ручка
1541,петуния изя вейв рассада однолетний цветок горшок
1542,флокс растопыривать голубой
1543,агератум рассада однолетний цветок кассета
1544,фиалка белый розовый кайма
1545,щетка труднодоступный место скребок
1546,вешалкасушилка
1547,крепеж пружина дверной оцинковывать
1548,крышка оцинковывать стерилизация банка банка
1549,декоративный композиция искуственный цветок букет роза цветок цвет ассортимент
1550,калибрахоа красный махровый
1551,хризолидокарпус лутесценс
1552,роза патио красный
1553,сушилка белье виолета настенный
1554,набор форма кекс нержавеющий сталь
1555,годеция рембранд
1556,цикламен белый
1557,хлебница
1558,рассада капуста белокачать сибирячка кассета
1559,флокс метельчатый катенькакатюша диаметр горшок
1560,томат помидор этуаль детерминантный среднеспелый розовый
1561,скиммия японский рубелла
1562,петуния черный
1563,однолетний растение циния кассета россия
1564,полотенце прессованный авто хлопок
1565,сетка глажение ява ртк
1566,тележка багажный ручной сумка каркас тбр синий красный клетка
1567,сумка тележка большой комбинированный
1568,новогодний дерево ель канадский коника ртк
1569,чехол одежда дорожный
1570,рассада огурец арамис кассета
1571,махровый халат женский размер алина
1572,карниз ванный комната виолета раздвижной кольцо белый
1573,калибрахоа ампельный
1574,флокс друммонд смесь
1575,сумкатележка хозяйственный бордовый
1576,афеляндра скуаррос дания микс кашпо автополив
1577,подголовник ванный комната пвх синий
1578,рассада зелень кухня мята бэррис энд крим
1579,полка лондон белый
1580,хризантема корейский смесь окраска
1581,таз пластмассовый пищевой круглый минеральный вода
1582,подрукавник складной ника
1583,герань домашний пеларгония зональный цвести малиновый красный полумахровый
1584,муляж манго оранжевый полиуретан
1585,роза одноголовый родос кения плантация штука упаковка
1586,муляж яблоко
1587,диффенбахий топпер день учитель подарочный упаковка
1588,тарелка десертный бамбук
1589,коврик резиновый ажурный
1590,таз пластмассовый ручка полимербыт
1591,пеларгония зональный белый полумахровый
1592,таз пластмассовый строительный прямоугольный
1593,пеларгония зональный сиреневый простой
1594,средство мытье пол испания
1595,цветок искусственный тюльпан ассортимент одиночный
1596,томат помидор гигант куба индетерминантный среднеспелый черный
1597,сушилка белье
1598,коврик придверный рельефный рисунок коричневый
1599,сковорода дема алюминиевый крышка металический ручка
1600,чехол гладильный доска металлизировать поролон доска
1601,бегония клубневой
1602,тележка хозяйственный багажный грузоподъемность
1603,набор махровый салфетка фита хлопок цвет ассортимент
1604,муляж лимон желтый полиуретан
1605,ерш унитаз подставка керамический
1606,лестницастремянка ступенчатый
1607,вешалка напольный фанк
1608,складной картонный коробка хранение уголок белый
1609,штора встроенный кольцо штанга ванна душа жаккард полиамидный покрытие белый
1610,муляж ананас
1611,корзина белье бамбук угловой
1612,фатсия японский
1613,контейнер мусор графитовый
1614,гладильный доска ника стелла классик стк
1615,штора встроенный кольцо штанга ванна душа жаккард полиамидный покрытие розовый
1616,шпингалет белый пружина
1617,тарелка десертный стоунмания оранж
1618,сменный блок ролик
1619,сушилка белье одноуровневый крыло
1620,сушилка белье прима синий напольный
1621,гладильный доска
1622,ведро мусор бежевый
1623,искусственный цветок роза закрытый малый пластиковый красный
1624,мусорный контейнер хром
1625,рассада зелень кухня лаванда эдельвейс
1626,мирт
1627,базилик овощной тонус кассета штука среднеспелый
1628,тележка багажный тбр цвет ассортимент грузоподъемность россия
1629,физостегия вергинский белый
1630,рассада капуста белокачать средний надежда кассета
1631,одеяло микрофибра микроволокно
1632,рассада зелень кухня мята эппл минт
1633,искусственный цветок ромашка пластик
1634,коврик придверный резина кокос соломка коричневый
1635,муляж яблоко зеленый полиуретан
1636,плед флисовый полиэстер бежевый айленд
1637,сумкатележка хозяйственный багажный красный грузоподъемность
1638,гладильный доска оранжевый
1639,рассада капуста цветной сноуболла кассета
1640,вешалка закругленный плечики перекладина противоскользящий покрытие черный
1641,полка мадрид белыйчерный штука штука
1642,рассада зелень кухня душицаорегано розовый
1643,петрушка корневой сахарный кассета штука скороспелый
1644,термос стеклянный колба темнозеленый
1645,разделочный доска классика
1646,сушилка белье напольный ника
1647,стремянка ступень алюминиевый
1648,хризантема белый кристалл
1649,калибрахоа розовосиреневый
1650,сервировочный салфетка пвх ванда
1651,пуансеттия белый
1652,искусственный цветок подснежник садовый пластиковый белый
1653,ерш унитазный подставка люкс мультипласт
1654,кастрюля круглый серый чугунный крышка
1655,эвкалипт сильвердроп
1656,покрывало стеганый
1657,нож чистка овощ нержавеющий сталь
1658,простыня двуспальный хлопок белосиреневый ванильа
1659,рассада зелень кухня мята спэйниш
1660,искусственный цветок гвоздик садовый пластиковый белый
1661,гладильный доска домина
1662,весы настольный электронный ксе белый
1663,мыло ручной работа свинюшка грязюшко
1664,кружка мерный
1665,ткань окно влажный сухой чистка
1666,петуния оранжевый
1667,скатерть донна роза пвх роза овальный
1668,капуста цветной мовир кассета штука скороспелый
1669,подвесной кашпо петуния белый
1670,рассада пряный трава лавр горшок
1671,чехол гладильный доска хлопок доска
1672,кружка чай сердечко дсг
1673,пуансеттия розовый
1674,штора текстильный ванна душа полиэстер разноцветный пузырек розовжелтбелый
1675,кружка лили флауэр
1676,рассада капуста кольраби гулливер кассета
1677,прищепок белье
1678,рассада арбуз сибирский огонь горшок
1679,мешок строительный мусор зеленый
1680,монард гибридный бергамо красный
1681,георгин черный красавица
1682,петуния малиновобелый
1683,искусственный цветок сирень пластиковый лиловый
1684,томат помидор земляника оранжевый индетерминантный среднеспелый оранжевый
1685,роза мини розовый
1686,штора встроенный кольцо штанга ванна душа жаккард полиамидный покрытие голубой
1687,искусственный цветок ландыш пластиковый большой белый
1688,чехол короткий одежда
1689,однолетний растение портулак кассета россия
1690,рудбекия тайгер голд золотой
1691,ручкаскоб белый трибатрон
1692,коврик противоскользящий пузырек бирюзовый
1693,цветок искусственный тюльпан пластик цвет ассортимент
1694,нож столовый
1695,стеллаж обувь светлый
1696,рыбочистка деревянный ручка нож
1697,рассада дыня дина горшок
1698,бакоп ампельный мегакрупный белый
1699,коврик придверный полипропилен спать кот бежевый
1700,мокружок зеленый
1701,рассада зелень кухня ориганум ауреум компактум
1702,корзина белье виолета крышка ротанг белый
1703,штора ванный комната пвх белый
1704,чайник электрический нержавеющий сталь
1705,роза садовый чайногибридный горшок керио
1706,петуния бургундить прожилка
1707,штора ванная зеленый
1708,подвесной кашпо гелихризум серебристый
1709,сверлофреза нитрид титан
1710,пеларгония плющелистный розовый подвесной кашпо
1711,рассада тыква витаминный горшок
