,0
0,щеткаутюжок ручка миди
1,соланум
2,кампануть махровый двухцветный
3,вешалка напольный складной светлый степанов
4,сушилка белье напольный ника белый
5,гладильный доска сити
6,петуния махровый рассада однолетний цветок горшок
7,коврик ванный комната милена коричневый
8,сидение ванна раздвижной белый ника
9,корзина
10,рассада зелень кухня розмарин блю лагуна
11,лобелия регатт микс
12,томат помидор бычий сердце
13,стремянка ступенчатый алюминиевый
14,миксер сероголубой насадка скоростной режим турбореживать
15,пеларгония розебудный укоренять черенок
16,рассада зелень кухня душица обыкновенный хуторянка
17,тарелка обеденный кашимый пурпл
18,вешалка блузка зеленый
19,рассада тыква дачный горшок
20,искусственный цветок букет примула пластиковый лиловый
21,змееголовник молдавский горыныч кассета штука среднеспелый
22,набор бокал император франция
23,махровый полотенце дакка хлопок
24,томат помидор аргентинский сливка индетерминантный среднеспелый красный
25,муляж виноград черный полиуретан
26,сушилка белье потолочный лиана люкс ллп
27,роза мини желтый
28,чехол одежда большой светлобежевый валиант
29,нож кухонный мясо пластмассовый ручка русский линия нхм метиз
30,алиссум рассада однолетний цветок кассета
31,сциндапсус ассортимент укоренять черенок
32,базилик пурпурный звезда
33,рассада зелень кухня петрушка универсал кассета
34,чехол гладильный доска
35,томат помидор перцевидный полосатый детерминантный среднеспелый красный
36,роза садовый чайногибридный горшок папилон
37,сушилка белье настенный ника белый
38,искусственный цветок ветка петуния пластиковый лиловый
39,цикламен розовый белый
40,томат помидор абрикосовый брендивайн индетерминантный среднеспелый оранжевый
41,рассада огурец есаул кассета
42,таз пластмассовый круглый водолей
43,калатея микс
44,рассада томат помидор эфемер детерминантный раннеспелый красный
45,герань домашний пеларгония зональный цвести красный махровый
46,сумкатележка хозяйственный голубой
47,чайник эмалированный свисток пластиковый ручка туттифрутти
48,рассада арбуз астраханский горшок
49,баклажан самурай крым
50,коробка хранение молния синтетический волокно зеленый
51,салатник кутюр
52,штора ванный душа текстильный цветок голубой
53,рассада зелень кухня мята кассета
54,сушилка белье напольный хромировать сталь
55,тюльпан лувр бахромчатый
56,пеларгония розоцветный ред розебуд молодой растение
57,томат помидор оранжевый русский индетерминантный среднеспелый оранжевый
58,чехол гладильный доска термостатический ассортимент
59,роза садовый чайногибридный горшок эдванс
60,штора ванный комната полиэстер красный
61,флокс метельчатый гжель диаметр горшок
62,петуния фиолетовый прожилка
63,лаванда торх
64,чехол гладильный доска хлопок поролон доска
65,юкка нитчатый
66,салатник эмпилабль
67,алоэ вера
68,петуния каскад смесь махровый
69,петуния розовый прожилка
70,цветок искусственный ландыш пластик
71,штора ванная спирелла текстиль гидрофобный пропитка серочерный
72,штора ванный комната пвх ракушка бежевый
73,стиральный биопорошок концентрированный белый белье россия
74,аргирантерум рассада однолетний цветок горшок
75,огурец боярский пчелоопыляемый кассета штука раннеспелый
76,нож универсальный
77,осина обыкновенный высота
78,тортница
79,веник сорго деревянный ручка шов
80,вешалка блузка красный
81,сумкатележка хозяйственный бирюзовый
82,бидон пластмассовый
83,кипарисовик лавсон элвуди ртк горшок нидерланды
84,стеллаж обувь венг
85,сушилка белье напольный ника сбпс
86,бегония ампельный
87,синнингия глоксиния фиолетовый
88,настурция орхидный пламень
89,перчатка латексный размер
90,гладильный доска ника лина
91,коврик придверный персия бордо
92,петля рояльный оксид
93,рассада томат помидор любимец подмосковье кассета
94,термокружок забава ркм вишня
95,капуста белокочанный июньский кассета штука раннеспелый
96,вкладыш хранение посуда
97,дендробиум санки анна грин ствол
98,муляж желудь
99,рассада зелень кухня базилик шалун кассета
100,рассада зелень кухня тимьян вульгарис компактус
101,рассада зелень кухня тимьян сильвер кинг
102,штора ванная бежевый
103,гвоздик травянка белокрасный
104,томат детерминантный сердолик кассета штука раннеспелый
105,карниз ванный комната виолета раздвижной кольцо голубой
106,корзина белье виолета вязь крышка лиловый
107,пеларгония зональный малиновый розовый простой
108,литопс микс
109,муляж яблоко красный
110,лен небесный лазурь голубой
111,аптение
112,солидаго желтый
113,набор кухонный полотенце хлопок мелис
114,кружка тачка франция
115,штора ванный комната пвх водоросль
116,отжим ведро синий
117,мята махито укоренять черенок
118,мусорный контейнер белый
119,фал капроновый бухта
120,короб стеллажный крышка большой
121,этажерка обувь узкий полк медный ника
122,кружка шэйдс блэк
123,гладильный доска ника белль классик
124,пена ванна хвойный пихта россия
125,калла крупноцветковый малиновый
126,дендробиум фиолетовый россия штука упаковка
127,муляж красный яблоко мини полиуретан
128,вешалка настенный ника крючок медный антик
129,гладильный доска ника
130,контейнер свч полимербыт премиум
131,насадка швабра пластик микрофибра
132,сушилка белье потолочнонастенный
133,тарелка суповой стоунмания капучино
134,коробка перфорировать крышка белый
135,средство удаление известковый налет поверхность сантехнический прибор антикальций россия
136,скребок клипса тряпка пластик
137,салатник эмпилабль велад
138,муляж виноград зеленый полиуретан
139,гипоаллергенный концентрированный гель стирка белье деликатный ткань корея
140,петля приварной гаражный шарик
141,томат помидор легенда тарасенко индетерминантный среднеспелый красный
142,гладильный доска ника верона чехол мужчина роза двм
143,стремянка ступень белый
144,муляж яблоко оранжевый полиуретан
145,зверобой продырявливать оптимист
146,пеларгония зональный лососевый махровый
147,гладильный доска ника эльза люкс
148,патиссон диск раннеспелый
149,простыня вафельный хлопок
150,кувшин пластмассовый крышка кумган
151,капуста декоративный смесь
152,тимьян
153,стремянка металлический ступень ника
154,роза садовый парковый горшок эден роуз
155,гладильный доска тефлон золотой
156,кондиционер белье свежесть океан флакон корея
157,гортензия микс кашпо автополив
158,коврик придверный пиано
159,нефролепис бостон
160,вешалка блузка черный
161,рассада томат помидор золотой руно кассета
162,петуния розовый прожилка
163,рассада томат помидор баскью блю детерминантный среднеспелый синий
164,томат детерминантный медовый кассета штука среднеспелый
165,рассада томат помидор ола полк детерминантный раннеспелый оранжевый
166,вантуз черный пластиковый ручка малый маг
167,крючок проволочный медь
168,весы напольный электронный
169,петля рояльный цинк
170,роза садовый спрей горшок солнечный девочка
171,бузульник пржевальский кленолистный желтый
172,весы напольный механический
173,жестяной банка новый паста микс
174,примула комнатный акаулис синий
175,чехол одежда розовый принт
176,декабрист горшок белый
177,новогодний дерево ель сербский
178,чайный набор карин ромашка оаэ
179,фиалка малиновый простой
180,капуста цветной гарантия кассета штука скороспелый
181,миска пластмассовый круглый пластхозторг
182,блюдо серия конья диаметр
183,корзина белье виолета ротанг угловой крышка бежевый
184,гладильный доска ника эльзаюниор эль
185,альбук спиралиса фризлсизлый
186,тарелка десертный син сильвер
187,штора ванная спирелла текстиль гидрофобный пропитка шампань
188,рассада зелень кухня сантолина хамаекипарисус
189,мешок деликатный стирка
190,томат помидор спать леди детерминантный среднеспелый черный
191,ящик хранение прозрачный
192,рассада капуста белокачать поздний колобок кассета
193,корыто оцинковывать бесшовный
194,штора ванный комната текстильный
195,штора ванный спирелла синий полиэтилен
196,петрушка итальянский гигант
197,рассада пеларгония герань зональный блу айза смесь
198,коврик придверный хлопковый мультиколор
199,ложка столовая сталь
200,фоторамка фотография бронзовый
201,ведро ягода полимербыт
202,томат помидор большой полосатый кабан индетерминантный среднеспелый красный
203,штора ванный кольцо мыльный пузырь
204,пеларгония тюльпановидный
205,камнеломка тенистый вариегат розовый
206,полотенце махровый гармония хлопок
207,сумкатележка хозяйственный красный
208,пеларгония грандифлора махровый микс
209,гладильный доска ника николь
210,муляж тыква
211,сидение ванна пластмассовый
212,коврик ванна розовый
213,одеяло пуховый белый белый пух
214,пеларгония топпер день учитель подарочный упаковка
215,штора ванный комната полиэстер белый горох
216,тарелка суповой ирис
217,декоративный коробка пластиковый
218,бакоп ампельный махровый фиолетовый махровый
219,базилик смесь зеленый фиолетовый
220,циния рассада однолетний цветок кассета
221,цикламен цвет ассортимент
222,гербера
223,лоток холодец эмалировать пластмассовый крышка рисунок скп стэм
224,холодный сварка универсальный
225,коврик придверный добро пожаловать
226,уголок оконный медь антик полимерный покрытие тонар
227,искусственный цветок ампельнвя петуния пластиковый красный
228,муляж булка
229,тележка багажный тбр синий грузоподъемность сумка каркас россия
230,бархатцы веселый полянка
231,коврик кухонный
232,декоративный коробка
233,примула комнатный цвет фуксия
234,банка рондо валенсия китай
235,гиностемма укоренять черенок
236,виола рассада однолетний цветок кассета
237,сушилка белье настенный ника серебро
238,ковер придверный серый
239,вешалка мягкий деликатный вещь шоколад
240,чайник заварочный металлический фильтр
241,скатерть лувр полиэфир овальный салатовый лувр
242,сумкатележка хозяйственный фиолетовый
243,полотенце прессованный сердце хлопок
244,рассада пряный трава кофе арабика горшок
245,искусственный цветок гербера пластиковый светлолиловый
246,многофункциональный инструмент функция
247,косметь попсокс белый
248,рассада томат помидор суперэкзотика индетерминантный среднеспелый черный
249,петуния красный
250,радермахер
251,тарелка обеденный стоунмания оранж
252,дыня алтайский скороспелый
253,скатерть азалия полиэфир хлопок прямоугольный персиковый азалия
254,комнатный растение горшок аспарагус мейер
255,герань домашний пеларгония зональный цвести белый махровый
256,драцена фрагранс компакт
257,рассада зелень кухня кориандр кассета
258,чайный ложка сталь
259,бак белье стальной
260,гладильный доска ника эльза классик элк
261,сушилка белье виолета настеннопотолочный
262,монард горшок
263,ерш радиаторный ручка
264,салатник арти пурпл
265,сумкатележка хозяйственный сиреневый
266,противень прямоугольный алюминиевый эксперт
267,коврик влаговпитывать ребристый стандарт синий
268,герань домашний пеларгония зональный цвести коралловый полумахровый
269,сумкатележка хозяйственный коричневый
270,комнатный растение горшок плектрантус подвесной горшок
271,полка барселона белый
272,штора ванный комната белый
273,вешалка самоклеющий крючок
274,стремянка бытовой алюминиевый ступенька
275,искусственный композиция цветок пластиковый мини елочка зеленый голубой
276,замиокулькас
277,гладильный доска перф металл эльза премиум элп ника
278,плечики пластмассовый размер
279,душица обыкновенный
280,коврик придверный дизайн резина кокос готический узор
281,хлебница пластмасовой больший
282,крассула
283,тележка багажный тбр коричневый грузоподъемность сумка каркас россия
284,цинерания рассада однолетний цветок кассета
285,рассада зелень кухня петрушка корневой сахарный кассета
286,рассада зелень кухня розмарин оффициналис тусканный блю
287,молодило микс
288,томат помидор юсуповский узбекский индетерминантный позднеспелый красный
289,пеларгония зональный розовый малиновый полумахровый
290,декабрист горшок красный
291,полка пекин белыйчерный
292,патиссон нло белый раннеспелый
293,девичий виноград пятилисточковый крым
294,сковорода алюминиевый керамический покрытие бьянка вок
295,нивянник ромашка крупноцветковый белый
296,тарелка обеденный грин форест
297,коврик ванный комната хлопок светлобежевый
298,набор бокал шампанское леди даймонд франция
299,томат помидор мохнатый кейт детерминантный среднеспелый синий
300,штанга ванная гобразный угловой хром
301,томат помидор арбузный индетерминантный среднеспелый красный
302,крокус голубой горшок луковица
303,щеткасметка рядный деревянный плоский ручка поиск риф
304,перчатка специальный защита рука
305,сумкатележка колесный голубой
306,набор стакан ежевика дсг
307,томат помидор большой оранжевый полосатый индетерминантный среднеспелый оранжевый
308,томат помидор голубика индетерминантный среднеспелый синий
309,муляж персик мини полиуретан
310,герань домашний пеларгония зональный цвести малиновый махровый
311,тарелка десертный воларэ блэк
312,вилка столовая сталь
313,кофр хранение подкроватный
314,косметь лимонад
315,рассада пряный трава эвкалипт сильвердроп горшок
316,чехол гладильный доска тефлоновый
317,вилка столовая предмет кокос свк
318,штора ванный комната полиэстер аквамарин
319,примула комнатный цвет ассортимент
320,сушилка белье мини навесный
321,гортензия метельчатый грейта старый горшок
322,комплект ванный туалет лавр бежевый
323,сидение гладильный доска
324,рассада зелень кухня зверобой продырявливать оптимист
325,рассада кассета огурец атос
326,томат помидор исуповский индетерминантный среднеспелый красный
327,набор вешалка костюм цвет кремовый
328,муляж вишня магнит
329,фуксия малиновый белый чашелист
330,штора ванный комната текстиль белозеленый
331,холодный сварка труба батарея
332,ель канадский коника ртк горшок нидерланды
333,искусственный цветок букет примула пластиковый розовый
334,ванна оцинковывать гмагнитогорск
335,коврик придверный дизайн резина кокос
336,штора ванная белый
337,набор вешалка деревянный перекладина лиловый
338,штора ванный комната полиэстер море
339,контейнер мусор доминик серебристый
340,средство против засор система водопровод антизасор россия
341,петуния белый махровый
342,ведро овальный отжим швабра моп черенок высота
343,гладильный доска ника верона чехол одри дво
344,рассада огурец персей кассета
345,короб стеллажный крышка малый
346,сушилка белье настенный веревочный линия
347,урнапепельница нержавеющий сталь хоббик
348,стакан ванный комната керамика коричневый
349,тележка багажный грузоподъемность россия
350,петуния простой рассада однолетний цветок кассета
351,каланхое каландив малиновый
352,томат помидор черниченский черри индетерминантный позднеспелый черный
353,сушилка белье ванна ника
