,0
700,мединилла магнифика
701,ваза маскарад франция
702,лантан
703,цинния коралловый красавица
704,мимоза стыдливый
705,швабра пол отжим фиксатор микрофибра
706,муляж банан желтый полиуретан
707,сумка хозяйственный колесо
708,сушилка белье виолета белый
709,муляж долька арбуз
710,антуриум андрианум фиорино
711,эвкалипт сильвердроп горшок
712,рассада зелень кухня лаванда горшок
713,коврик интерьерный кухня пвх прямоугольный
714,кувшин пластмассовый крышка пластхозторг
715,каланхое каландив белый
716,тележка хозяйственный ролл крыло
717,калоцефалус брауни крашеный осенний микс
718,антуриум андрианум многоцветковый красный
719,коврик придверный влаговпитывать перерабатывать резина ковровый покрытие
720,гардения
721,бальзамин новогвинейский белый
722,цинерария серебряный пыль
723,дендробиум яблоневый россия штука упаковка
724,рассада капуста белокачать ранний малахит кассета
725,примула комнатный розовый
726,огурец алтай пчелоопыляемый кассета штука раннеспелый
727,петуния белый
728,гортензия микс
729,томат помидор ракета детерминантный среднеспелый красный
730,петуния сиреневый прожилка
731,сушилка
732,рассада зелень кухня мелисса лимонный зеленый
733,банка металлический крышка круглый
734,томат помидор фейерверк индетерминантный среднеспелый красный
735,рассада зелень кухня тимьян горшок
736,рассада кабачок аэронавт кассета
737,рассекатель пламень газовый плита ручка
738,коврик придверный листопад
739,кружка дисней микки колорс
740,роза садовый почвопокровный горшок ред вельвет
741,муляж черешня желтый желтый
742,нож кухонный универсальный пластмассовый ручка русский линия нхм метиз
743,алиссум лобулярий снежный одежда
744,томат помидор арбузик индетерминантный раннеспелый красный
745,жестяной банка горошек
746,муляж вишня вишневый полиуретан
747,томат помидор красный пушистый кабан детерминантный среднеспелый красный
748,вешалка напольный бук темный колесико степанов
749,калибрахоа сиреневый звезда
750,чехол одежда объемный овальный окно пвх ручка коричневый
751,пеларгония зональный белый махровый
752,скатерть прямоугольный ажурный бежевый тесненый рисунок
753,муляж персик полиуретан
754,вешалка деревянный расширять плечики перекладина белый
755,петуния рассада смесь цветок лист красный
756,капуста брюссельский сапфир кассета штука позднеспелый
757,рыбочистка металлический
758,таз пластмассовый пищевой
759,шеффлер лузеан
760,комплект постельный белье авеню пододеяльник простыня наволочка
761,фуксия кассета штука цвет ассортимент
762,декабрист горшок белый розовый кайма
763,стремянкатабурет алюминиевый ступень
764,бельевой прищепок классик
765,однолетний растение петуния махровый кассета россия
766,муляж морковь
767,сушилка белье напольный ника двухуровневый белый
768,нетканый салфетка рулон
769,чайный набор рейнбоу
770,лопатка прорезь
771,томат помидор дрова детерминантный среднеспелый красный
772,перчатка латекс защита рука аллергия
773,огурец аристократ пчелоопыляемый кассета штука раннеспелый
774,овощеварка алюминиевый хозлэнд
775,лавр нобилис
776,томат помидор графити индетерминантный раннеспелый красный
777,подголовник ванный комната пвх
778,муляж клубника полиуретан
779,фиалка
780,рассада огурец каролина кассета
781,ковер придверный лапша коричневый
782,роза садовый чайногибридный горшок черри бренди
783,сушилка белье виолета серый
784,рассада капуста белокачать московский поздний кассета
785,нож кухонный овощ деревянный ручка гурман нхм метиз
786,эхинокактус грузонь красный
787,нож стейк
788,сушилка белье лиана люкс потолочный
789,роза садовый парковый горшок голдни селебрейшен
790,флокс метельчатый незабудка диаметр горшок
791,настенный сушилка белье
792,нож мясорубка супер лепесток
793,крючок одежный тройной латунь
794,кофе арабика горшок
795,муляж перец красный полиуретан
796,роза садовый чайногибридный горшок лампион
797,искусственный цветок тюльпан пластиковый открытый яркокрасный
798,рассада клубника вим рина кассета ремонтантный
799,хлебница деревянный бук
800,чехол гладильный доска защелка
801,ящик хранение фимако люкс плетеный крышка бежевый
802,светильник настольный лампа светодиодный сенсорный диммер черный
803,рассада огурец нежинский ячейка
804,томат помидор индиго роуз детерминантный среднеспелый синий
805,бальзамин новогвинейский ярко красный
806,линейка длина
807,стремянка алюминиевый ступень ника
808,гладильный доска томрис
809,лестница стремянка зми конек медный антик
810,отделитель косточка вишня
811,ящик почтовый металлический врезной замок почта
812,бакоп ампельный махровый белый махровый
813,ткань универсальный микрофибры серый
814,лилейник высокорослый смесь окраска
815,роза патио оранжевый
816,рассада зелень кухня тимьян вариегэйтид
817,шпагат полипропиленовый ктекс цветной бобина размотка изнутри
818,петлястрел рыбинск
819,покрывало жаккард шенилл наволочка
820,кухонный полотенце махровый фреш
821,крючок проволочный белый
822,сахарница фарфоровый
823,таз пластмассовый пищевой круглый
824,лоток белый
825,томат балконный чудо
826,рассада зелень кухня мангольд кассета
827,термокружок вакуумный нержавеющий сталь коричневый
828,рассада остеоспермум крупноцветковый малиновый
829,тарелка суповой стоунмания оранж
830,фен дорожный бордовый черный режим мощность россия
831,капуста цветной дачница кассета штука среднеспелый
832,циперус зумул
833,пресс чеснок
834,просеиватель мука
835,антуриум андрианум блэк
836,сумкатележка стальной каркас серый
837,штора ванная розовый
838,рассада томат помидор аделин горшок
839,морковь детский сладость
840,петуния фиолетовобелый
841,примула комнатный малиновый
842,муляж вишня полиуретан
843,лопатка
844,рассада томат помидор джессика индетерминантный раннеспелый красный
845,рассада кабачок якорь кассета
846,автоматический щетка мытье окно ручка
847,набор фужер шампанский френч брассери франция
848,штора ванный комната пвх серый
849,сантолина
850,настольный гладильный доска фанера ника
851,наматрицникчехол стебель бамбук сбн односпальный бамбуковый молочный
852,насадка швабра многофункциональный микрофибры
853,штора ванный комната зеленый текстильный
854,набор ковер ванный комната офелия ххсм серыйбежевый
855,шнур резиновый тележка
856,искусственный цветок гербера пластиковый розовый
857,перчатка резиновый универсальный
858,аквилегия обыкновенный барлоу микс
859,стяжка оконный болт цинк
860,томат помидор бандед амазон индетерминантный раннеспелый розовый
861,кувшин виктория крышка
862,щеткасметка рядный деревянный фигурный ручка ворс
863,цинния ацтек бургунди биколор
864,цикламен комнатный
865,спатифиллум свита лауретта
866,салатник арти пинк
867,мускарь горшок луковица
868,эшшольция карминный король
869,кофр хранение средний
870,таз пластмассовый овальный
871,покрытие гладильный доска веревка жасмин
872,искусственный цветок роза открытый малый пластиковый красный
873,ложка чайный сталь
874,флокс метельчатый полина диаметр горшок
875,тарелка обеденный альто сапфир
876,рассада зелень кухня шпинат кассета
877,тележка хозяйственный складной пэмби
878,герань домашний пеларгония зональный цвести малиновый розовый простой
879,гладильный доскастремянка
880,сушилка белье стена
881,фуксия прямостоячий белый красный лепесток горшок
882,чехол одежда малый светлобежевый валиант
883,амариллис темнокрасный горшок луковица
884,лантан горшок
885,арбуз шуга бейби раннеспелый
886,роза садовый чайногибридный горшок блю парфюм
887,комнатный растение пуансеттия
888,кориандр стимул раннеспелый кассета штука
889,концентрат мытье посуда зеленый чай россиякорея
890,новогодний дерево ель канадский коника декоративный контейнер
891,стремянка бытовой ступень
892,перчатка латексный
893,петрушка листовой обыкновенный листовой кассета штука скороспелый
894,цветок искусственный роза алый бархатный раскрытый бутон
895,лук порей победитель кассета штука среднеспелый
896,ролик чистка одежда слой
897,ковш пластмассовый полимербыт
898,столовый нож сапфир тяжелый
899,корзина белье эльфпласт виола коричневый
900,чехол гладильный доска дизайн хлопок
901,рассада огурец фараон ячейка
902,ведро полимербыт гриб
903,ароматизированный средство дудаление известковый налет ржавчина гель лимон россия
904,сушилка белье напольный ника сба цвет аквамаринбелый
905,комнатный растение горшок алый вера
906,томат помидор ширли сердцевидный индетерминантный среднеспелый розовый
907,ковер придверный белый
908,искусственный цветок лилейник пластиковый светлолиловый
909,искусственный цветок роза маргарита пластик
910,пеларгония укоренять черенок
911,кофр малый жесткий леопард валиант
912,рукав гладильный доска дсп
913,фуксия ампельный темнофиолетовый вишневый лепесток подвесной кашпо
914,тележка багажный синий грузоподъемность сумка каркас россия
915,измельчитель овощ ручной деревянный нож
916,салатник поэма анис
917,рассада зелень кухня мята хилариса свита лемон
918,искусственный композиция цветок пластиковый ромашка мини розовый
919,рассада томат помидор розовый фламинго кассета
920,флокс метельчатый мари диаметр горшок
921,рассада зелень кухня розмарин барбекю
922,герань домашний пеларгония зональный цвести ярко розовый полумахровый
923,пеларгония плющелистный ампельный
924,томат помидор сладкий касаживать индетерминантный среднеспелый оранжевый
925,кружка прозрачный франция
926,вешалкастойка сакура авангард венг
927,муляж баклажан
928,миксер электрический погружной белый сиреневый скорость
929,бальзамин новогвинейский цвет фуксия
930,петуния рассада смесь цветок лист фиолетовый белый ободок
931,шнур хозяйственный цветной
932,швабра мытье окно телескоп ручка
933,скатерть джулия полиэстер хлопок
934,петуния рассада смесь цветок лист розовый махровый
935,весы электронный кухонный круглый стеклянный серебро кггр
936,томат помидор большой оранжевый индетерминантный среднеспелый оранжевый
937,томат помидор медовый индетерминантный позднеспелый розовый
938,банка стекло сыпучий продукт круглый пластмассовый крышка цветной вкладка
939,томат помидор большой желтый зебра индетерминантный среднеспелый желтый
940,томат помидор синий тигр индетерминантный среднеспелый синий
941,таз пластмассовый пищевой мерка минеральный вода
942,вешалка закруглять плечики перекладина крючок противоскользящий покрытие черный
943,термометр уличный оконный
944,рассада зелень кухня розмарин найф
945,коврик влаговпитывать индия зигзаг серый
946,однолетний растение газание кассета россия
947,многолетний растение душицаорегано розовый
948,корзина белье виолета угловой крышка ротанг белый
949,цветок искусственный гвоздик тканевый красный
950,рассада капуста белокачать грибовский кассета
951,скатерть жаклин полиэфир хлопок квадратный бежевый жаклин
952,термометр окно уличный липучка
953,гладильный доска фанера стелла премиум стп ника
954,кружка трубочка мяч
955,коврик интерьерный вино
956,калибрахоа оранжевокрасный махровый
957,термокружок яромир кремль ярмо
958,комплект мытье пол нержавеющий сталь пластика зеленый швабрамоп ведро механизм отжим
959,коврик придверный пористый полимерный материал коричневый
960,роза кустовой ред лейс кения плантация штука упаковка
961,кипятильник электрический квт
962,лаванда горшок
963,корзина гладить белье коричневый
964,пеларгония зональный коралловый полумахровый
965,томат помидор джалп детерминантный среднеспелый красный
966,пеларгония зональный розовый полумахровый
967,насадкаотжим пластиковый бирюзовый ведро
968,вешалкастойка сакура слуга колесо сосна
969,салфетка стол узор цвет белый
970,салфетка шоколад
971,лестницастремянка алюминевый ступенчатый
972,пеларгония зональный ринго вайт укоренять черенок
973,калибрахоа желтый махровый
974,рассада перец болгарский сладкий красный чудо горшок
975,вербена яркорозовый
976,подарочный набор март пеларгония красный подарочный упаковка открытка
977,герань домашний пеларгония зональный цвести сиреневокрасный простой
978,роза патио белый
979,горох амброзия
980,фаленопсис королевский голубой ствол
981,рассада зелень кухня базилик арарат кассета
982,пеперомия
983,комод эльфпласт виола секционный коричневый
984,рассада капуста белокачать средний подарок кассета
985,кружка радуга керамический коричневый
986,калибрахоа фиолетовый махровый
987,мыло ручной работа сувенир подарок март классика
988,пиретрум робинсон красный
989,флокс метельчатый вальс диаметр горшок
990,цветок искусственный нарцисс одиночный ассортимент
991,хризантема кустовой стрес нидерланды штука упаковка
992,томат помидор амурский тигр детерминантный раннеспелый красный
993,масленка коровка крышка франция
994,салатник рапсоди оранж
995,крючок одежный рожковый серый металлик полимерный покрытие тонар
996,плечики пластмассовый размер тула
997,халат вафельный виктория хлопок размер салатовый
998,цинния хааг олд мехико
999,чехол гладильный доска универсальный поролон антипригарный чпа ника
1000,рассада капуста белокачать подарок кассета
1001,подсолнечник низкорослый
1002,муляж виноград цвет ассортимент
1003,контейнер мусор оранжевый
1004,овощечистка плавать лезвие нержавеющий сталь пластика белый
1005,ножеточка универсальный рыбка
1006,термокружок красный
1007,вешалка брюки юбка металлический
1008,чехол одежда
1009,платикодон махровый синий
1010,скатерть круглый полиэстер хлопок белый эстель
1011,искусственный цветок пластиковый мак бутон
1012,аспарагус спренжери
1013,подвесной кашпо петуния микс смесь окраска
1014,пеларгония зональный малиновокрасный простой
1015,корзинка крышка кремовый
1016,подвесной кашпо пеларгония махровый темнокрасный
1017,гвоздик садовый рассада однолетний цветок горшок
1018,косметь попсокс розовый
1019,пеларгония зональный махровый белый
1020,цветок искусственный роза закрывать бутон цвет ассортимент
1021,томат помидор минусинский индетерминантный среднеспелый розовый
1022,банка стеклянный крышка круглый
1023,тарелка суповой мок браун
1024,сметка совок престиж
1025,салфетка серый
1026,пуансеттия горшок белый красный
1027,томат детерминантный грандесса кассета штука раннеспелый
1028,муляж лимон мини магнит
1029,фиттоний скелетон
1030,коробка хранение бамбук
1031,вербейник монетчатый желтый
1032,однолетний растение сальвия кассета россия
1033,штора ванная прозрачный пвх рисунок
1034,сумкатележка хозяйственный синий
1035,сушилка белье напольный ника серый
1036,вантуз черный длинный ручка
1037,корзина белье виолета крышка ротанг капучино
1038,коврик ванный комната полиакрил светлокоричневый
1039,тележка багажный тбр коричневый оранжевый грузоподъемность сумка каркас россия
